{
  "rule_id": "SF-010",
  "alert_count": 1,
  "evidence_event_ids": [
    "evt-sf010-positive-01",
    "evt-sf010-positive-02",
    "evt-sf010-positive-03",
    "evt-sf010-positive-04"
  ],
  "entities": {
    "host": [
      "ws-417.sentinelforge.test"
    ],
    "domain": [
      "a1b2c3d4e5f6g7h8i9j0k1l2m3n4o5p6q7r8s9t0u1v2w3x40.telemetry.example.test",
      "a1b2c3d4e5f6g7h8i9j0k1l2m3n4o5p6q7r8s9t0u1v2w3x41.telemetry.example.test",
      "a1b2c3d4e5f6g7h8i9j0k1l2m3n4o5p6q7r8s9t0u1v2w3x42.telemetry.example.test",
      "a1b2c3d4e5f6g7h8i9j0k1l2m3n4o5p6q7r8s9t0u1v2w3x43.telemetry.example.test"
    ]
  }
}
